{
  "schema_version": 1,
  "batch_id": "aaaaaaaa-aaaa-4aaa-8aaa-aaaaaaaaaaaa",
  "user_id": "demo-user-1",
  "device_id": "demo-iphone-1",
  "sent_at": "2026-07-18T14:32:06Z",
  "metrics": [
    {
      "schema_version": 1,
      "metric_id": "11111111-1111-4111-8111-111111111111",
      "user_id": "demo-user-1",
      "metric_type": "heart_rate",
      "acquisition_class": "live",
      "value": 108.0,
      "unit": "count/min",
      "observed_at": "2026-07-18T14:32:05Z",
      "source": "apple_live_workout",
      "source_kind": "apple_live_workout",
      "source_name": "Demo Apple Watch",
      "source_bundle_id": "com.example.vitalrelay",
      "device_model": "Apple Watch",
      "simulated": false,
      "quality": "good",
      "used_for_escalation": false
    },
    {
      "schema_version": 1,
      "metric_id": "22222222-2222-4222-8222-222222222222",
      "user_id": "demo-user-1",
      "metric_type": "respiratory_rate",
      "acquisition_class": "recent_context",
      "value": 16.0,
      "unit": "count/min",
      "observed_at": "2026-07-18T08:10:00Z",
      "source": "apple_healthkit",
      "source_kind": "apple_healthkit",
      "source_name": "Demo Apple Watch",
      "source_bundle_id": "com.apple.health",
      "device_model": "Apple Watch",
      "simulated": false,
      "quality": null,
      "used_for_escalation": false
    },
    {
      "schema_version": 1,
      "metric_id": "44444444-4444-4444-8444-444444444444",
      "user_id": "demo-user-1",
      "metric_type": "step_count",
      "acquisition_class": "recent_context",
      "value": 2450.0,
      "unit": "count",
      "observed_at": "2026-07-18T14:30:00Z",
      "source": "replay_pedometer",
      "source_kind": "replay",
      "source_name": "Deterministic demo fixture",
      "source_bundle_id": null,
      "device_model": null,
      "simulated": true,
      "quality": "good",
      "used_for_escalation": false
    }
  ]
}
